### ISSUE TITLE
Proxy Issue

### ISSUE THREAD

**Issue by git-hub-nub** [splunk/ta-cisco-webex-meetings-add-on-for-splunk#9]
Hi Team,

Can you please implement proxy support as soon as practical. 

173.243.0.152 resolves to the webex tenancy, not our proxy address.

01:13:16.464009 IP 192.168.1.2.55210 > 173.243.0.152.https: Flags [S], seq 578338387, win 29200, options [mss 1460,sackOK,TS val 2517315825 ecr 0,nop,wscale 7], length 0
01:13:17.466489 IP 192.168.1.2.55210 > 173.243.0.152.https: Flags [S], seq 578338387, win 29200, options [mss 1460,sackOK,TS val 2517316828 ecr 0,nop,wscale 7], length 0
01:13:19.470533 IP 192.168.1.2.55210 > 173.243.0.152.https: Flags [S], seq 578338387, win 29200, options [mss 1460,sackOK,TS val 2517318832 ecr 0,nop,wscale 7], length 0
01:13:23.478547 IP 192.168.1.2.55210 > 173.243.0.152.https: Flags [S], seq 578338387, win 29200, options [mss 1460,sackOK,TS val 2517322840 ecr 0,nop,wscale 7], length 0
 
[root@heavyforwarder local]# cat ta_cisco_webex_meetings_add_on_for_splunk_settings.conf
[proxy]
proxy_enabled = 1
proxy_port = 8080
proxy_rdns = 0
proxy_type = http
proxy_url = 192.168.1.10

**Comment by mayurah** [comment]
@git-hub-nub 

A small [fix](https://github.com/splunk/ta-cisco-webex-meetings-add-on-for-splunk/commit/6dab813618966b7c6e4c211b4f8e0c0ad4df6a00#diff-a80f5524db292a8a050498443bf2ecbd) helped! 


Added downloadable TAR (tgz) under [pre-release](https://github.com/splunk/ta-cisco-webex-meetings-add-on-for-splunk/releases/tag/1.1.2).

Tested with Charles proxy.

**Comment by git-hub-nub** [comment]
Thank you for the quick feature enhancement! 

Confirmed this is working with a FortiProxy
